CanalID,Nombre,VideoID,Titulo,Fecha,Vistas,Likes,Comentarios
UCCKMZAvEMR7IzVKBxyLb9Lg,https://youtube.com/@floydtvonline?si=jUPNtgg266-y5k8q,-mVGbB2yuXg,#BerniLlaver demostró que tiene reflejos. o al menos eso intentó. 😈🙌 #floydtv #stream,2026-04-01,2053,3,0
UCCKMZAvEMR7IzVKBxyLb9Lg,https://youtube.com/@floydtvonline?si=jUPNtgg266-y5k8q,JpZq2C0BUbA,"MUCHAS SORPRESAS, HOMENAJEAMOS A LOS CAIDOS E INVITADOS IMPERDIBLES",2026-03-30,0,0,0
UCCKMZAvEMR7IzVKBxyLb9Lg,https://youtube.com/@floydtvonline?si=jUPNtgg266-y5k8q,sgn70CKA2DM,todos peleamos nuestras propias batallas.💬 ¿La bici alguna vez te salvó?#RidersStream #floydtv,2026-03-26,263,3,0
UCCKMZAvEMR7IzVKBxyLb9Lg,https://youtube.com/@floydtvonline?si=jUPNtgg266-y5k8q,xZTx6jsuWKw,Yo y mis personalidades 🤣🤣 #floydtv #humor #trend,2026-03-26,1407,13,0
UCCKMZAvEMR7IzVKBxyLb9Lg,https://youtube.com/@floydtvonline?si=jUPNtgg266-y5k8q,xXxVxWy7_vM,26 de marzo de 2026,2026-03-26,1310,15,0
UCCKMZAvEMR7IzVKBxyLb9Lg,https://youtube.com/@floydtvonline?si=jUPNtgg266-y5k8q,S6kt8qhEeWk,#digaloconmimica #floydtv #poneleonda,2026-03-24,1574,13,0
UCCKMZAvEMR7IzVKBxyLb9Lg,https://youtube.com/@floydtvonline?si=jUPNtgg266-y5k8q,tAnrkcrOQdM,"Meta melón , meta sandia 😳🔥",2026-03-13,1417,15,0
UCCKMZAvEMR7IzVKBxyLb9Lg,https://youtube.com/@floydtvonline?si=jUPNtgg266-y5k8q,FrUdRWy1IK4,mi voz en momentos importantes. Te amamos Lu!,2026-03-10,7851,79,3
UCCKMZAvEMR7IzVKBxyLb9Lg,https://youtube.com/@floydtvonline?si=jUPNtgg266-y5k8q,0koEtEJBE88,#acequias de #mendoza conocidas como atrapaporteños pero esta ocasión traicionó a mendocinas,2026-03-08,1182,6,0
UCCKMZAvEMR7IzVKBxyLb9Lg,https://youtube.com/@floydtvonline?si=jUPNtgg266-y5k8q,7vHGWCtiTmM,#conociendoarusia vs #gauchitoclub #floydtv,2026-03-08,1443,23,1
UC7WpCrWnAh5DoHtMxbrtMnQ,https://youtube.com/@chocotvok?si=2YVCEG5eRz7k7bcY,Vb3l7dfLSzg,"Gaga no es una era, es la industria ✨",2026-04-02,623,45,0
UC7WpCrWnAh5DoHtMxbrtMnQ,https://youtube.com/@chocotvok?si=2YVCEG5eRz7k7bcY,FiSTP3lZkkw,EL MARIDAJE IDEAL,2026-03-30,112,0,0
UC7WpCrWnAh5DoHtMxbrtMnQ,https://youtube.com/@chocotvok?si=2YVCEG5eRz7k7bcY,bf9zhIO6Z-8,¿Qué suena en el Wine Rock?,2026-03-30,520,1,0
UC7WpCrWnAh5DoHtMxbrtMnQ,https://youtube.com/@chocotvok?si=2YVCEG5eRz7k7bcY,lwCsK0X529U,Gauchito Club,2026-03-23,485,2,0
UC7WpCrWnAh5DoHtMxbrtMnQ,https://youtube.com/@chocotvok?si=2YVCEG5eRz7k7bcY,g8EXpWDdoRY,Cruzando el Charco,2026-03-23,192,0,0
UC7WpCrWnAh5DoHtMxbrtMnQ,https://youtube.com/@chocotvok?si=2YVCEG5eRz7k7bcY,myGi_7AWDo8,Silvestre y la Naranja,2026-03-23,185,2,0
UC7WpCrWnAh5DoHtMxbrtMnQ,https://youtube.com/@chocotvok?si=2YVCEG5eRz7k7bcY,vlyNMxJRFfI,RESUMEN: MALBEC Y OLIVO,2026-03-23,208,1,0
UC7WpCrWnAh5DoHtMxbrtMnQ,https://youtube.com/@chocotvok?si=2YVCEG5eRz7k7bcY,ilE2fQ3AnNo,¿A QUIÉN VINISTE A VER?,2026-03-23,862,11,0
UC7WpCrWnAh5DoHtMxbrtMnQ,https://youtube.com/@chocotvok?si=2YVCEG5eRz7k7bcY,gXjycNBY0-Y,"SALUD, MAIPÚ!",2026-03-23,295,1,0
UC7WpCrWnAh5DoHtMxbrtMnQ,https://youtube.com/@chocotvok?si=2YVCEG5eRz7k7bcY,h3GkeYCdd2g,PUNTUANDO OUTFITS,2026-03-23,1680,23,0
UC7WpCrWnAh5DoHtMxbrtMnQ,https://youtube.com/@chocotvok?si=2YVCEG5eRz7k7bcY,E7_OtSWc_Vk,EL FESTIVAL DESDE ADENTRO,2026-03-22,642,5,0
UC7WpCrWnAh5DoHtMxbrtMnQ,https://youtube.com/@chocotvok?si=2YVCEG5eRz7k7bcY,UvIN2vD4dmA,Festival del Malbec y el Olivo ✨,2026-03-22,1128,8,0
UC7WpCrWnAh5DoHtMxbrtMnQ,https://youtube.com/@chocotvok?si=2YVCEG5eRz7k7bcY,6PvV38wx4SI,El crossover definitivo: Sabrina Carpenter y Maria Becerra,2026-03-16,20202,1506,8
UC7WpCrWnAh5DoHtMxbrtMnQ,https://youtube.com/@chocotvok?si=2YVCEG5eRz7k7bcY,k92XFZiCjIs,¡Al borde del abismo!,2026-03-16,1302,28,2
UC7WpCrWnAh5DoHtMxbrtMnQ,https://youtube.com/@chocotvok?si=2YVCEG5eRz7k7bcY,RamnlctJzdY,DE YOUTUBE AL MUNDO: Maria Becerra,2026-03-11,4272,236,3
UC7WpCrWnAh5DoHtMxbrtMnQ,https://youtube.com/@chocotvok?si=2YVCEG5eRz7k7bcY,16qCIZeXBmQ,SE CASARON TOM Y ZENDAYA,2026-03-07,23066,3116,8
UC7WpCrWnAh5DoHtMxbrtMnQ,https://youtube.com/@chocotvok?si=2YVCEG5eRz7k7bcY,FjF9EWr3tiw,¿Cómo se vivió el cumple de la Arístides?,2026-03-06,1201,8,0
UC7WpCrWnAh5DoHtMxbrtMnQ,https://youtube.com/@chocotvok?si=2YVCEG5eRz7k7bcY,oK9_FL1MjO0,Aniversario Arístides,2026-03-06,455,3,0
UC7WpCrWnAh5DoHtMxbrtMnQ,https://youtube.com/@chocotvok?si=2YVCEG5eRz7k7bcY,gAH1lso2D7I,PUNA MUSIC,2026-03-06,140,3,0
UC7WpCrWnAh5DoHtMxbrtMnQ,https://youtube.com/@chocotvok?si=2YVCEG5eRz7k7bcY,G5Aziiv_jtc,Conociendo Rusia,2026-03-06,1072,7,0
UCxtCp4e1pGevREzI4aCMjow,https://youtube.com/@elbunkermza?si=DYKceoHFUHXZNPzW,MKWZKKjZeTY,LUNES 6 DE ABRIL 18 HS #volvemosmejores,2026-04-01,61,1,0
UCxtCp4e1pGevREzI4aCMjow,https://youtube.com/@elbunkermza?si=DYKceoHFUHXZNPzW,HGJ3ArUfoAQ,"""De repente empecé a entender todo desde mi historia"", Claudia Domínguez Castro nieta #117 #nuncamás",2026-03-28,903,14,1
UCxtCp4e1pGevREzI4aCMjow,https://youtube.com/@elbunkermza?si=DYKceoHFUHXZNPzW,4flbtdCShZI,"""Nuestro objetivo era que no nos rompieran como seres humanos""",2026-03-26,563,24,1
UCxtCp4e1pGevREzI4aCMjow,https://youtube.com/@elbunkermza?si=DYKceoHFUHXZNPzW,dklIz20JdHw,DOMINGO 22 A LAS 22 POR YOUTUBE #estreno #nuncamás #son30mil #24demarzo,2026-03-21,681,13,0
UCxtCp4e1pGevREzI4aCMjow,https://youtube.com/@elbunkermza?si=DYKceoHFUHXZNPzW,stxkyqkicl4,"Recorrimos el ex Centro Clandestino de Detención, Tortura y Exterminio más grande de Mendoza",2026-03-19,1395,13,0
UCxy1_VhGyaCbto2-DcXqk_w,https://youtube.com/@serebrosstv?si=XcpEMWAXDYY1bK0E,I5p_qeoNuEQ,LA LUPA 20 | LOS NEPHILIM Y LA ALTERACIÓN GENÉTICA,2026-03-31,376,11,0
UCxy1_VhGyaCbto2-DcXqk_w,https://youtube.com/@serebrosstv?si=XcpEMWAXDYY1bK0E,UEnWP8g8TjQ,ESPECIAL DE PAREJAS EN LA LUPA #parejas #vinculos #amor,2026-03-26,930,15,0
UCxy1_VhGyaCbto2-DcXqk_w,https://youtube.com/@serebrosstv?si=XcpEMWAXDYY1bK0E,mBoI0qhauCw,Las caderas si mienten #streaming #mendoza #humor #baile,2026-03-25,1703,20,0
UCxy1_VhGyaCbto2-DcXqk_w,https://youtube.com/@serebrosstv?si=XcpEMWAXDYY1bK0E,VscU-EHSu54,COMPETENCIA DE STREAMS,2026-03-25,36,0,0
UCxy1_VhGyaCbto2-DcXqk_w,https://youtube.com/@serebrosstv?si=XcpEMWAXDYY1bK0E,Z-4s3WyTav4,¿Cómo ve la gente a una reina de la Vendimia y qué es realmente lo que hacen? #vendimia #reinas,2026-03-21,1173,10,0
UCxy1_VhGyaCbto2-DcXqk_w,https://youtube.com/@serebrosstv?si=XcpEMWAXDYY1bK0E,vvScDP7wZDY,PERSECUCIÓN Y CENSURA DE LA LIGA SANRAFAELINA #futbol #deportes #sanrafael,2026-03-19,719,20,1
UCxy1_VhGyaCbto2-DcXqk_w,https://youtube.com/@serebrosstv?si=XcpEMWAXDYY1bK0E,ruTn6Qkel0w,Te hablaron de Dios y te condenaron #escatologia #streaming #dios #biblia,2026-03-18,1032,13,2
UCxy1_VhGyaCbto2-DcXqk_w,https://youtube.com/@serebrosstv?si=XcpEMWAXDYY1bK0E,-zVuOymQMKw,ESTAMOS HABLANDO DE TORTAS FRITAS • #elcablestream,2026-03-17,157,4,0
UCxy1_VhGyaCbto2-DcXqk_w,https://youtube.com/@serebrosstv?si=XcpEMWAXDYY1bK0E,og5eVGqRUQg,Desafío Borges con figuras sanrafaelinas #streaming #laberinto #hebecasado,2026-03-12,5,0,0
UCxy1_VhGyaCbto2-DcXqk_w,https://youtube.com/@serebrosstv?si=XcpEMWAXDYY1bK0E,Oi2seDazD08,PENTATUEL EN 60 SEGUNDOS #deportes #streaming,2026-03-11,778,9,0
UCxy1_VhGyaCbto2-DcXqk_w,https://youtube.com/@serebrosstv?si=XcpEMWAXDYY1bK0E,aVrW8-2sqkI,TURISMO EN SAN RAFAEL #streaming #humor #hebecasado,2026-03-11,1706,5,0
UCxy1_VhGyaCbto2-DcXqk_w,https://youtube.com/@serebrosstv?si=XcpEMWAXDYY1bK0E,VlOk8MNqLAA,TUTORIAL PARA LLENAR UN PERFUMERO. #humor #tutorial #canaldestreaming #streaming #mendoza,2026-03-06,778,14,0
UCxy1_VhGyaCbto2-DcXqk_w,https://youtube.com/@serebrosstv?si=XcpEMWAXDYY1bK0E,krvSG4gAI1E,Situación del futbol argentino.,2026-03-05,834,12,0
UCxy1_VhGyaCbto2-DcXqk_w,https://youtube.com/@serebrosstv?si=XcpEMWAXDYY1bK0E,wuXT5hCWnLU,PROFESIONES MÁS INFIELES 🔥,2026-03-03,17,2,0
UCC6Y5cYmvlQ_4-J6jOSOK_Q,https://youtube.com/@agenciaaluza?si=tqe-doEcJA4LnwLn,x7LOOAcK3jc,PARA HACER STAND UP TENES QUE SER UN FRACASADO,2026-04-02,822,4,0
UCC6Y5cYmvlQ_4-J6jOSOK_Q,https://youtube.com/@agenciaaluza?si=tqe-doEcJA4LnwLn,Cz3JZ462NkU,ROCKY LE COPIO A PAPITO BARLOA,2026-04-02,450,13,0
UCC6Y5cYmvlQ_4-J6jOSOK_Q,https://youtube.com/@agenciaaluza?si=tqe-doEcJA4LnwLn,PKw6KtRTodA,SETAƧ EN PILA TV,2026-03-31,288,1,0
UCC6Y5cYmvlQ_4-J6jOSOK_Q,https://youtube.com/@agenciaaluza?si=tqe-doEcJA4LnwLn,Do8gL0Cit4k,"""NOS VAMOS A EQUIVOCAR MÁS DE LO QUE VAMOS A ACERTAR",2026-03-30,258,2,0
UCC6Y5cYmvlQ_4-J6jOSOK_Q,https://youtube.com/@agenciaaluza?si=tqe-doEcJA4LnwLn,Tk_A2fyoJW8,MAIPU VS GODOY CRUZ,2026-03-30,453,7,0
UCC6Y5cYmvlQ_4-J6jOSOK_Q,https://youtube.com/@agenciaaluza?si=tqe-doEcJA4LnwLn,dmGx9QKMc1s,LOS ACTORES SECUNDARIOS DEL FUTBOL ARGENTINO,2026-03-30,545,12,0
UCC6Y5cYmvlQ_4-J6jOSOK_Q,https://youtube.com/@agenciaaluza?si=tqe-doEcJA4LnwLn,cNJqCv9bLyA,SOY UN AGRADECIDO AL CLUB Y A LA VIDA,2026-03-30,175,2,0
UCC6Y5cYmvlQ_4-J6jOSOK_Q,https://youtube.com/@agenciaaluza?si=tqe-doEcJA4LnwLn,i-ecLZ_MB8U,MIS ABUELAS LLEVABAN TODA SU VIDA BUSCÁNDOME,2026-03-27,586,17,2
UCC6Y5cYmvlQ_4-J6jOSOK_Q,https://youtube.com/@agenciaaluza?si=tqe-doEcJA4LnwLn,cze_e9Vbnzg,¿QUE ES UN JUICIO DE LESA HUMANIDAD?,2026-03-27,536,18,2
UCC6Y5cYmvlQ_4-J6jOSOK_Q,https://youtube.com/@agenciaaluza?si=tqe-doEcJA4LnwLn,iEOxj3elOvM,HABLEMOS DEL 24M CON NIÑAS Y NIÑOS,2026-03-27,616,13,0
UCC6Y5cYmvlQ_4-J6jOSOK_Q,https://youtube.com/@agenciaaluza?si=tqe-doEcJA4LnwLn,M6W0ZWqgLjE,LOS JUICIOS DE LESA HUMANIDAD EN MENDOZA,2026-03-25,549,9,1
UCC6Y5cYmvlQ_4-J6jOSOK_Q,https://youtube.com/@agenciaaluza?si=tqe-doEcJA4LnwLn,hVlAPHkpVtQ,EN UN GENOCIDA NO EXISTE AMOR,2026-03-25,571,10,2
UCC6Y5cYmvlQ_4-J6jOSOK_Q,https://youtube.com/@agenciaaluza?si=tqe-doEcJA4LnwLn,HtoAsb8E0Ic,SON 30.000M LOS DESAPARECIDOS,2026-03-25,579,15,3
UCC6Y5cYmvlQ_4-J6jOSOK_Q,https://youtube.com/@agenciaaluza?si=tqe-doEcJA4LnwLn,HeaU9tiiz2M,PROPIEDADES CON MALAS VIBRAS,2026-03-23,461,8,0
UCC6Y5cYmvlQ_4-J6jOSOK_Q,https://youtube.com/@agenciaaluza?si=tqe-doEcJA4LnwLn,fkeSfI7ucB4,LIGA NACIONAL DE VOLEY FEM EN MENDOZA,2026-03-23,852,16,0
UCC6Y5cYmvlQ_4-J6jOSOK_Q,https://youtube.com/@agenciaaluza?si=tqe-doEcJA4LnwLn,G7acUYBX8tw,FUNDACION EMPATE MENDOZA,2026-03-23,166,4,0
UCC6Y5cYmvlQ_4-J6jOSOK_Q,https://youtube.com/@agenciaaluza?si=tqe-doEcJA4LnwLn,i15yZrLY_Hg,TORNEO PROVINCIAL DE TORTITA RASPADA VOL 2,2026-03-23,719,7,0
UCC6Y5cYmvlQ_4-J6jOSOK_Q,https://youtube.com/@agenciaaluza?si=tqe-doEcJA4LnwLn,zLtmmI-7DSU,BERTI ES PARA INDEPENDIENTE RIVADAVIA COMO GALLARDO PARA RIVER,2026-03-23,692,13,0
UCC6Y5cYmvlQ_4-J6jOSOK_Q,https://youtube.com/@agenciaaluza?si=tqe-doEcJA4LnwLn,wBk2pwAj5kU,"LOS CHIMENO SON MENTIROSOS, NI UN VASO DE AGUA",2026-03-23,838,17,0
UCC6Y5cYmvlQ_4-J6jOSOK_Q,https://youtube.com/@agenciaaluza?si=tqe-doEcJA4LnwLn,PS-GaWe5CRk,"MENDOZA, TIERRA DEL SOL Y DEL BUEN VINO 🍷 ¿BUEN VINO A QUE COSTO?",2026-03-18,635,14,1
UCC6Y5cYmvlQ_4-J6jOSOK_Q,https://youtube.com/@agenciaaluza?si=tqe-doEcJA4LnwLn,Pe7jaFelBmE,DESAFÍO A IVAN DE PINEDA,2026-03-18,909,15,0
UCC6Y5cYmvlQ_4-J6jOSOK_Q,https://youtube.com/@agenciaaluza?si=tqe-doEcJA4LnwLn,lC43zqvsCIU,LEGROTAGLIE Y MENOTTI,2026-03-16,1379,23,0
UCC6Y5cYmvlQ_4-J6jOSOK_Q,https://youtube.com/@agenciaaluza?si=tqe-doEcJA4LnwLn,gU723mtk03E,NO CUALQUIERA JUEGA EL PARTIDO DEL DESCENSO,2026-03-16,407,4,0
UCC6Y5cYmvlQ_4-J6jOSOK_Q,https://youtube.com/@agenciaaluza?si=tqe-doEcJA4LnwLn,PncfSk4qTqA,"""A VILLA NO LO PODES SACAR""",2026-03-16,1056,11,0
UCC6Y5cYmvlQ_4-J6jOSOK_Q,https://youtube.com/@agenciaaluza?si=tqe-doEcJA4LnwLn,ykRg1t3BfNo,ME SIENTO CULPABLE DEL DESCENSO,2026-03-14,731,11,0
UCC6Y5cYmvlQ_4-J6jOSOK_Q,https://youtube.com/@agenciaaluza?si=tqe-doEcJA4LnwLn,4J_RLpd7Hqw,¿IDOLA O PROMESA?,2026-03-14,1110,17,1
UCC6Y5cYmvlQ_4-J6jOSOK_Q,https://youtube.com/@agenciaaluza?si=tqe-doEcJA4LnwLn,zl0dPOmVNWY,"SI HAY PIROTECNIA, HAY DR@64*",2026-03-14,1111,24,1
UCC6Y5cYmvlQ_4-J6jOSOK_Q,https://youtube.com/@agenciaaluza?si=tqe-doEcJA4LnwLn,AzkJn2MoRjY,"""PRACTICABA EN MI CASA PARA CUANDO LO TUVIERA QUE SALUDAR""",2026-03-12,1005,28,1
UCC6Y5cYmvlQ_4-J6jOSOK_Q,https://youtube.com/@agenciaaluza?si=tqe-doEcJA4LnwLn,ir4U1xQAtkA,CHANTAS DE LINKED-IN,2026-03-11,836,14,1
UCC6Y5cYmvlQ_4-J6jOSOK_Q,https://youtube.com/@agenciaaluza?si=tqe-doEcJA4LnwLn,Khb-E5wtqv0,HABLAMOS DE EX'S (y le cantamos una canción 😂),2026-03-11,831,11,0
UCC6Y5cYmvlQ_4-J6jOSOK_Q,https://youtube.com/@agenciaaluza?si=tqe-doEcJA4LnwLn,fU2qccejDHw,VENDEDOR DE CD'S,2026-03-11,960,25,0
UCC6Y5cYmvlQ_4-J6jOSOK_Q,https://youtube.com/@agenciaaluza?si=tqe-doEcJA4LnwLn,EycWFtzMNmM,EL SEGUNDO JULIAN ALVAREZ,2026-03-09,598,21,0
UCC6Y5cYmvlQ_4-J6jOSOK_Q,https://youtube.com/@agenciaaluza?si=tqe-doEcJA4LnwLn,bUWMot7kX3Y,LA VENDIMIA ES ANSIEDAD,2026-03-09,715,10,0
UCC6Y5cYmvlQ_4-J6jOSOK_Q,https://youtube.com/@agenciaaluza?si=tqe-doEcJA4LnwLn,Av_50fmhKrY,EL BARBERO DEL PLANTEL LEPROSO,2026-03-08,1026,23,1
UCC6Y5cYmvlQ_4-J6jOSOK_Q,https://youtube.com/@agenciaaluza?si=tqe-doEcJA4LnwLn,1RC72jKHSWM,Parecidos?,2026-03-05,921,16,1
UCC6Y5cYmvlQ_4-J6jOSOK_Q,https://youtube.com/@agenciaaluza?si=tqe-doEcJA4LnwLn,X5ZFQm7uRN8,LAS PROMESAS DE JULI NAVARRO,2026-03-05,1008,21,0
UCC6Y5cYmvlQ_4-J6jOSOK_Q,https://youtube.com/@agenciaaluza?si=tqe-doEcJA4LnwLn,uwR-15ZkEc8,TORNEO DE TORTITAS,2026-03-04,406,9,0
UCC6Y5cYmvlQ_4-J6jOSOK_Q,https://youtube.com/@agenciaaluza?si=tqe-doEcJA4LnwLn,7JyBY90W3IE,LA MAGA Y EL MAGO,2026-03-04,915,30,0
UCC6Y5cYmvlQ_4-J6jOSOK_Q,https://youtube.com/@agenciaaluza?si=tqe-doEcJA4LnwLn,iHTAhRXKISA,¿EL PROGRAMA MÁS TERMO?,2026-03-04,841,27,0
UCC6Y5cYmvlQ_4-J6jOSOK_Q,https://youtube.com/@agenciaaluza?si=tqe-doEcJA4LnwLn,yU0x4s18Xw0,DEFENDIENDO LO INDEFENDIBLE,2026-03-04,1034,21,0
UCC6Y5cYmvlQ_4-J6jOSOK_Q,https://youtube.com/@agenciaaluza?si=tqe-doEcJA4LnwLn,ofcPW4XEHuE,TODOS CONTRA FAUSTO,2026-03-04,1229,13,0
UCC6Y5cYmvlQ_4-J6jOSOK_Q,https://youtube.com/@agenciaaluza?si=tqe-doEcJA4LnwLn,sNJmNI6WSuM,Programación 2026 Pila Tv,2026-03-04,90,9,0
UCRw1y2JAiHN3mcjjCtrBBng,https://youtube.com/@canalbardo?si=IANKmAlZraytP1gI,FfBM00Asrjc,MENDOZA TIERRA DE SUNSETS,2026-03-21,870,16,0
UCRw1y2JAiHN3mcjjCtrBBng,https://youtube.com/@canalbardo?si=IANKmAlZraytP1gI,JWINtFpSr1s,QUE PASA SI ESTOY ENTREVISTANDO A ALGUIEN Y LE PEGO UNA PIÑA,2026-03-20,1376,25,0
UCRw1y2JAiHN3mcjjCtrBBng,https://youtube.com/@canalbardo?si=IANKmAlZraytP1gI,M269_F4XUBQ,CONSTRUCCIÓN DE PARQUES INDUSTRIALES - LAMBERTUCCI,2026-03-20,796,6,0
UCRw1y2JAiHN3mcjjCtrBBng,https://youtube.com/@canalbardo?si=IANKmAlZraytP1gI,vBnY9s1YJAs,EL DJ SE TIENE QUE FOCALIZAR EN LA MÚSICA NO EN LAS REDES,2026-03-20,1037,22,0
UCRw1y2JAiHN3mcjjCtrBBng,https://youtube.com/@canalbardo?si=IANKmAlZraytP1gI,cMCk5aWTtsg,¿EL PRODUCTOR DE EVENTOS ESTA LAVANDO GUITA DE ALGUIEN?,2026-03-19,1091,12,0
UCRw1y2JAiHN3mcjjCtrBBng,https://youtube.com/@canalbardo?si=IANKmAlZraytP1gI,WIB4UwDsdn0,INSTAGRAM ESTA LLENO DE HDP,2026-03-19,1026,10,0
UCRw1y2JAiHN3mcjjCtrBBng,https://youtube.com/@canalbardo?si=IANKmAlZraytP1gI,ec4YDtw56a4,ARGENTINA Y CHILE SOMOS LOS ÚNICOS PRODUCTORES DE NUEZ DEL HEMISFERIO,2026-03-19,8636,134,4
UC1gMJbPatMRNcWKQGfmw8MQ,https://youtube.com/@oidmortalesmza?si=XeujmJKrR_AFYcHm,u7t9vkhAzOI,"La ESI al banquillo: a veinte años de la Ley 26.150, ¿la ESI educa?”",2026-03-27,441,32,1
UCghFRyDAl663a6CPtjwXw9g,https://youtube.com/@sifonazostream?si=BJ5yAWV1ixXxL354,9BS5WcmCXB4,COLAPINTO EN BUENOS AIRES + REVIVIÓ CANAPINO + LLAVER PASEÓ EN EL TURCAR 2000 | STREAM MOTOR #7,2026-04-02,237,13,1
UCghFRyDAl663a6CPtjwXw9g,https://youtube.com/@sifonazostream?si=BJ5yAWV1ixXxL354,8mFpE1YcXPg,Los hinchas de #GodoyCruz en la final de la #LigaMendocina,2026-04-02,898,14,3
UCghFRyDAl663a6CPtjwXw9g,https://youtube.com/@sifonazostream?si=BJ5yAWV1ixXxL354,Q1dWvhzUnJk,Los hinchas de #IndependienteRivadavia en la final de la #LigaMendocina,2026-04-02,168,10,1
UCghFRyDAl663a6CPtjwXw9g,https://youtube.com/@sifonazostream?si=BJ5yAWV1ixXxL354,tUburceRovo,Se cortó tres veces el programa y la banda no se lo perdonó al equipo de técnica 😅👋🏻,2026-04-01,863,6,0
UCghFRyDAl663a6CPtjwXw9g,https://youtube.com/@sifonazostream?si=BJ5yAWV1ixXxL354,sKBFKS1P_58,La venta de entradas para los hinchas de #IndependienteRivadavia en la #CopaLibertadores,2026-04-01,381,13,0
UCghFRyDAl663a6CPtjwXw9g,https://youtube.com/@sifonazostream?si=BJ5yAWV1ixXxL354,YjtItffIP24,"Turela se fue al carajo con su comentario, respondió el Tiburón y estalló la mesa",2026-03-31,944,13,1
UCghFRyDAl663a6CPtjwXw9g,https://youtube.com/@sifonazostream?si=BJ5yAWV1ixXxL354,43fVfPS9tXo,Las cargadas a luego del triunfo de #GodoyCruz ante el #DeportivoMaipu,2026-03-31,892,34,2
UCghFRyDAl663a6CPtjwXw9g,https://youtube.com/@sifonazostream?si=BJ5yAWV1ixXxL354,3QXI7odv7Pg,#GodoyCruz le ganó al #DeportivoMaipu y así arrancó el programa Tomás Turela,2026-03-31,1332,32,5
UCghFRyDAl663a6CPtjwXw9g,https://youtube.com/@sifonazostream?si=BJ5yAWV1ixXxL354,aUuXSTKC8SI,"La palabra de Darío Franco, el nuevo DT de #Gimnasia",2026-03-30,843,12,0
UCghFRyDAl663a6CPtjwXw9g,https://youtube.com/@sifonazostream?si=BJ5yAWV1ixXxL354,p_zPWyZx5gY,La palabra de Alexis Matteo luego de la derrota del #DeportivoMaipu ante #GodoyCruz,2026-03-30,880,8,2
UCghFRyDAl663a6CPtjwXw9g,https://youtube.com/@sifonazostream?si=BJ5yAWV1ixXxL354,rG-Zf4hV6Ak,Los hinchas del #DeportivoMaipu y #GodoyCruz le ponen color a la tarde,2026-03-29,2354,35,7
UCghFRyDAl663a6CPtjwXw9g,https://youtube.com/@sifonazostream?si=BJ5yAWV1ixXxL354,WRJuMNqHye8,Llegó desde Francia de intercambio y se enamoró de #GodoyCruz,2026-03-29,1549,30,5
UCghFRyDAl663a6CPtjwXw9g,https://youtube.com/@sifonazostream?si=BJ5yAWV1ixXxL354,RHawml2i5hQ,"El #DeportivoMaipu y #GodoyCruz se enfrentan con ambos públicos, que sea una fiesta",2026-03-29,1154,2,0
UCghFRyDAl663a6CPtjwXw9g,https://youtube.com/@sifonazostream?si=BJ5yAWV1ixXxL354,RgHKMqVz1VQ,Los detalles de la llegada de Darío Franco a #Gimnasia,2026-03-29,2535,10,2
UCghFRyDAl663a6CPtjwXw9g,https://youtube.com/@sifonazostream?si=BJ5yAWV1ixXxL354,SBC1ORWUIFE,Los trabajos para que #Argentina vuelva a ser sede del #MotoGP en 2027,2026-03-28,74,1,0
UCghFRyDAl663a6CPtjwXw9g,https://youtube.com/@sifonazostream?si=BJ5yAWV1ixXxL354,qWqLA7apAfw,El calendario de #IndependienteRivadavia,2026-03-28,1814,7,0
UCghFRyDAl663a6CPtjwXw9g,https://youtube.com/@sifonazostream?si=BJ5yAWV1ixXxL354,E_G7mR7hlrE,El debate sobre el presente de #Gimnasia ante la llegada del nuevo DT en las próximas horas.,2026-03-27,991,1,0
UCghFRyDAl663a6CPtjwXw9g,https://youtube.com/@sifonazostream?si=BJ5yAWV1ixXxL354,ZSq6tkj5li0,Cosas que pueden pasar en un programa en vivo 📺⚽️😅,2026-03-26,868,9,0
UCghFRyDAl663a6CPtjwXw9g,https://youtube.com/@sifonazostream?si=BJ5yAWV1ixXxL354,B-Vs-GbeMVc,El gran presente de Fabrizio Sartori en #IndependienteRivadavia,2026-03-25,796,36,3
UCghFRyDAl663a6CPtjwXw9g,https://youtube.com/@sifonazostream?si=BJ5yAWV1ixXxL354,pp2sBjzUwm0,Abrimos debate: ¿Cuál es el clásico con mayor importancia en la provincia?,2026-03-25,2146,55,7
UCghFRyDAl663a6CPtjwXw9g,https://youtube.com/@sifonazostream?si=BJ5yAWV1ixXxL354,b9TTRQ4t94o,"Tras la salida de Ariel Broggi, Tiburon cuenta cuando el exentrenador del Lobo le marcó la cancha",2026-03-24,773,6,0
UCghFRyDAl663a6CPtjwXw9g,https://youtube.com/@sifonazostream?si=BJ5yAWV1ixXxL354,xMIrjpuykdI,El DT que está a un paso de llegar a #Gimnasia ante la salida de Ariel Broggi.,2026-03-24,1676,13,0
UCghFRyDAl663a6CPtjwXw9g,https://youtube.com/@sifonazostream?si=BJ5yAWV1ixXxL354,7pwlilNn4HU,Los hinchas del #DeportivoMaipu y todo el color en las tribunas en la #PrimeraNacional,2026-03-23,871,7,3
UCghFRyDAl663a6CPtjwXw9g,https://youtube.com/@sifonazostream?si=BJ5yAWV1ixXxL354,rHyEacd3ioU,Alfredo Berti y el grupo de #IndependienteRivadavia en la #CopaLibertadores,2026-03-23,835,14,0
UCghFRyDAl663a6CPtjwXw9g,https://youtube.com/@sifonazostream?si=BJ5yAWV1ixXxL354,xRXGraxyIv0,"Desde los techos, estos hinchas de #HuracánLasHeras alentaron a su equipo en el Torneo #FederalA",2026-03-23,2194,18,0
UCghFRyDAl663a6CPtjwXw9g,https://youtube.com/@sifonazostream?si=BJ5yAWV1ixXxL354,2kou17b0_BI,La ovación de los hinchas de #IndependienteRivadavia para sus jugadores,2026-03-23,1541,59,2
UCghFRyDAl663a6CPtjwXw9g,https://youtube.com/@sifonazostream?si=BJ5yAWV1ixXxL354,vjeW9i6qLpY,El festejo de los jugadores de #IndependienteRivadavia con Alex Arce.,2026-03-23,1568,40,1
UCghFRyDAl663a6CPtjwXw9g,https://youtube.com/@sifonazostream?si=BJ5yAWV1ixXxL354,MYl-JcT5EdQ,Los hinchas de #IndependienteRivadavia le dijeron de todo al ex #GodoyCruz Pol Fernández,2026-03-23,2534,34,2
UCghFRyDAl663a6CPtjwXw9g,https://youtube.com/@sifonazostream?si=BJ5yAWV1ixXxL354,Ot1v-crQR8g,Los hinchas del #DeportivoMaipu le cantan a #GodoyCruz,2026-03-22,828,10,4
UCghFRyDAl663a6CPtjwXw9g,https://youtube.com/@sifonazostream?si=BJ5yAWV1ixXxL354,wYnqJQp9V7o,Gran recibimiento de los hinchas de #HuracánLasHeras en el Torneo #FederalA,2026-03-22,1090,21,4
UCghFRyDAl663a6CPtjwXw9g,https://youtube.com/@sifonazostream?si=BJ5yAWV1ixXxL354,rIL8cFoesnQ,Franco Colapinto y sus primeros puntos del 2026 tras una gran carrera en el GP de China.,2026-03-21,968,10,0
UCghFRyDAl663a6CPtjwXw9g,https://youtube.com/@sifonazostream?si=BJ5yAWV1ixXxL354,P9qmb0yepDo,Los 11 de #Gimnasia para visitar a #Newells en el #TorneoApertura,2026-03-21,1892,8,0
UCghFRyDAl663a6CPtjwXw9g,https://youtube.com/@sifonazostream?si=BJ5yAWV1ixXxL354,5-B2pkIucN4,La venta de entradas para los hinchas de #GodoyCruz en el partido ante el #DeportivoMaipu,2026-03-20,1159,10,0
UCghFRyDAl663a6CPtjwXw9g,https://youtube.com/@sifonazostream?si=BJ5yAWV1ixXxL354,VSvoWOdNvvY,Los socios de #IndependienteRivadavia van a poder viajar en vuelos chárter en la #CopaLibertadores,2026-03-20,671,15,2
UCghFRyDAl663a6CPtjwXw9g,https://youtube.com/@sifonazostream?si=BJ5yAWV1ixXxL354,xor4KMkrN6w,Así sería el camino de #IndependienteRivadavia en la fase de grupos de la #CopaLibertadores,2026-03-20,854,15,0
UCghFRyDAl663a6CPtjwXw9g,https://youtube.com/@sifonazostream?si=BJ5yAWV1ixXxL354,C5iAO8I6ZGA,#IndependienteRivadavia comienza su camino en la #CopaLibertadores,2026-03-20,1769,34,3
UCghFRyDAl663a6CPtjwXw9g,https://youtube.com/@sifonazostream?si=BJ5yAWV1ixXxL354,MEQJuY8n_dw,Simulamos el sorteo de la #CopaLibertadores y así quedó el grupo de #IndependienteRivadavia,2026-03-19,413,7,0
UCghFRyDAl663a6CPtjwXw9g,https://youtube.com/@sifonazostream?si=BJ5yAWV1ixXxL354,rvB0l-igY7s,Los hinchas de #Gimnasia sobre #IndependienteRivadavia y el sorteo de la #CopaLibertadores,2026-03-19,723,6,0
UCghFRyDAl663a6CPtjwXw9g,https://youtube.com/@sifonazostream?si=BJ5yAWV1ixXxL354,Z9aLOp1wO4U,El camino internacional de #IndependienteRivadavia en la previa del sorteo de la #CopaLibertadores,2026-03-19,552,48,3
UCghFRyDAl663a6CPtjwXw9g,https://youtube.com/@sifonazostream?si=BJ5yAWV1ixXxL354,AKUkSd6vtHM,Los aplausos para Nahuel Ulariaga que volvió al gol en el triunfo #GodoyCruz en la #PrimeraNacional,2026-03-18,823,8,0
UCghFRyDAl663a6CPtjwXw9g,https://youtube.com/@sifonazostream?si=BJ5yAWV1ixXxL354,JTGzgIh-Qfo,La palabra de Ulpiano Suárez en el encuentro entre #Gimnasia y #Estudiantes,2026-03-18,797,5,2
UCghFRyDAl663a6CPtjwXw9g,https://youtube.com/@sifonazostream?si=BJ5yAWV1ixXxL354,9hxdKElJkAU,"Entre aplausos e insultos, así se retiró #Gimnasia luego de la derrota ante #Estudiantes",2026-03-18,2125,22,1
UCghFRyDAl663a6CPtjwXw9g,https://youtube.com/@sifonazostream?si=BJ5yAWV1ixXxL354,nv8lejYuCuA,“Piojo” López llegó al Legrotalie a ver el encuentro entre #Gimnasia y #Estudiantes,2026-03-18,5737,37,0
UCghFRyDAl663a6CPtjwXw9g,https://youtube.com/@sifonazostream?si=BJ5yAWV1ixXxL354,jIp_krsjHhc,#Gimnasia busca un central de jerarquía,2026-03-17,1195,6,0
UCghFRyDAl663a6CPtjwXw9g,https://youtube.com/@sifonazostream?si=BJ5yAWV1ixXxL354,xt545l_euG0,Ganó #GodoyCruz y así llegó Tomás Turela tras el primer triunfo del Tomba en el Gambarte.,2026-03-17,732,14,3
UCghFRyDAl663a6CPtjwXw9g,https://youtube.com/@sifonazostream?si=BJ5yAWV1ixXxL354,3DqokV6-kn0,Monjas visitaron el Gambarte en la previa del triunfo de #GodoyCruz,2026-03-17,1300,8,2
UCghFRyDAl663a6CPtjwXw9g,https://youtube.com/@sifonazostream?si=BJ5yAWV1ixXxL354,BIXOqFcRM00,Los hinchas de #IndependienteRivadavia y el sorteo de la #CopaLibertadores,2026-03-17,898,9,0
UCghFRyDAl663a6CPtjwXw9g,https://youtube.com/@sifonazostream?si=BJ5yAWV1ixXxL354,2196ZtT9KLw,Gonzalo Castellani y Ángel González volvieron a Mendoza,2026-03-16,1879,18,1
UCghFRyDAl663a6CPtjwXw9g,https://youtube.com/@sifonazostream?si=BJ5yAWV1ixXxL354,Q8Oi5Mr16LU,La reacción del triunfo de #IndependienteRivadavia ante #GimnasiaLP,2026-03-15,226,25,4
UCghFRyDAl663a6CPtjwXw9g,https://youtube.com/@sifonazostream?si=BJ5yAWV1ixXxL354,UsMtk9NZfZw,El festejo de Nahuel Ulariaga luego del gol en el triunfo de #GodoyCruz,2026-03-15,2477,33,0
UCghFRyDAl663a6CPtjwXw9g,https://youtube.com/@sifonazostream?si=BJ5yAWV1ixXxL354,NXbR8EibYkE,Los hinchas de #GodoyCruz le cantan a la barra que intentó demorar el partido en el Gambarte.,2026-03-14,2320,34,13
UCghFRyDAl663a6CPtjwXw9g,https://youtube.com/@sifonazostream?si=BJ5yAWV1ixXxL354,H_gUF9DsM0s,Así luce el estadio Feliciano Gambarte en la previa del partido entre #GodoyCruz y #Ferro,2026-03-14,1598,35,0
UCghFRyDAl663a6CPtjwXw9g,https://youtube.com/@sifonazostream?si=BJ5yAWV1ixXxL354,6FPCfhsrvWE,#GodoyCruz y un partido clave ante #Ferro en la #PrimeraNacional,2026-03-14,1240,10,0
UCghFRyDAl663a6CPtjwXw9g,https://youtube.com/@sifonazostream?si=BJ5yAWV1ixXxL354,0uZrd4Th8nE,Las críticas a Nicolás Bolcatto en el arco de #IndependienteRivadavia,2026-03-14,1464,8,1
UCghFRyDAl663a6CPtjwXw9g,https://youtube.com/@sifonazostream?si=BJ5yAWV1ixXxL354,vr0mz2zuZik,Siguen las comparaciones en Sifonazo y ahora le tocó cobrar a Juanma Quiroga.,2026-03-14,1008,14,0
UCghFRyDAl663a6CPtjwXw9g,https://youtube.com/@sifonazostream?si=BJ5yAWV1ixXxL354,7_yLJaxVSAQ,#GodoyCruz en la mira de AFA tras los incidentes en la #PrimeraNacional,2026-03-13,1355,5,3
